name,url,image,startDate,endDate,description,description_fr,location,city,region,page,region_abbr
Campo Sancho 2025,https://www.musicfestivalwizard.com/festivals/campo-sancho-2025/,https://www.musicfestivalwizard.com/wp-content/uploads/2024/12/Campo-Sancho-Editorial.jpg,2025-07-24,2025-07-27,"Sancho Panza was born in the underground in 1992. Building on a rich history that spans legendary early 90’s warehouse parties and a 20-year reign as the largest and most beloved house music sound system at Notting Hill Carnival, today it finds new life as Campo Sancho, a boutique festival haven for its loyal following of discerning music heads and their families. Through Campo Sancho, Sancho Panza continues to champion its signature DIY ethos and unwavering dedication to delivering truly unique, intimate and magical dancefloor experiences.","Sancho Panza est né dans the Underground en 1992. S'appuyant sur une riche histoire qui s'étend sur les parties légendaires du début des années 90 et un règne de 20 ans en tant que sonnerie de la vie la plus appréciée de Notting Hill. Campo Sancho, un refuge de festival de boutique pour son fidèle suivi de têtes musicales exigeantes et leurs familles. Grâce à Campo Sancho, Sancho Panza continue de défendre son éthique de bricolage signature et dévouement indéfectible à offrir des expériences de dancefloor magiques vraiment uniques.",Walkern Hall,Stevenage,United Kingdom,7,UK
Cheyenne Frontier Days 2025,https://www.musicfestivalwizard.com/festivals/cheyenne-frontier-days-2025/,https://www.musicfestivalwizard.com/wp-content/uploads/2024/07/Cheyenne-Frontier-Days-Logo.webp,2025-07-18,2025-07-27,This festival has been kicking up dust since 1897 with the world's largest outdoor rodeo & western celebration.,This Festival lance la poussière depuis 1897 avec le plus grand rodéo extérieur du monde et la célébration occidentale.,Cheyenne Frontier Days Arena,Cheyenne,Wyoming,7,WY
Das Fest 2025,https://www.musicfestivalwizard.com/festivals/das-fest-2025/,https://www.musicfestivalwizard.com/wp-content/uploads/2012/02/Das_Fest_Logo.jpg,2025-07-24,2025-07-27,"Known in Germany as simply The Festival, this event has been taking place annually since 1985. With free camping and an admission price under $20, this is one of Europe's top budget festivals.","Connu en Allemagne sous le nom de simple le festival, cet événement a eu lieu chaque année depuis 1985. Avec le camping gratuit et un prix d'admission de moins de 20 $, c'est l'une des festivals à petit budget de Europe.",Günther-Klotz-Anlage,Karlsruhe,Germany,8,DE
Floydfest 2025,https://www.musicfestivalwizard.com/festivals/floydfest-2025/,https://www.musicfestivalwizard.com/wp-content/uploads/2016/11/Floydfest_Logo.jpg,2025-07-23,2025-07-27,The homegrown Floydfest has only one modest aim: 'Our mission is to the be the best music experience of our time.' The lofty promise is generating results as each year the lineup gets deeper and the names get bigger. The famous Blue Ridge Parkway serves as your living room for the weekend.,Le homegrown floydfest n'a qu'un seul objectif modeste: 'Notre mission est à le être le la meilleure expérience musicale de notre temps.' La promesse lofty de la génère des résultats car chaque année la gamme devient plus profonde et les noms deviennent plus grands. Le célèbre bleu Ridge Parkway sert de salon pour le le week-end.,Blue Ridge Mountains,Floyd,Virginia,8,VA
Forest Fest 2025,https://www.musicfestivalwizard.com/festivals/forest-fest-2025/,https://www.musicfestivalwizard.com/wp-content/uploads/2025/02/Forest-Fest-2025-Lineup-Poster.jpg,2025-07-25,2025-07-27,"Forest Fest is known for it's summertime party atmosphere with well known headliners, Family Entertainment, Circus and Street Theatre, Award-winning street food, drumming workshops, maker area, craft beers, cocktail bar, and more!","Forest Fest est connu pour son atmosphère de fête d'été avec des têtes d'affiche bien connues, Family Entertainment, Circus and Street Theatre, Award Street Food, Drumming Ateliers, plus!",Emo Village,Laois,Ireland,8,IE
Fuji Rock Festival 2025,https://www.musicfestivalwizard.com/festivals/fuji-rock-festival-2025/,https://www.musicfestivalwizard.com/wp-content/uploads/2016/02/Fuji_Rock_Fest_2016_Logo-e1455395115366.jpg,2025-07-25,2025-07-27,"Over 100,000 fans show up at Naeba Ski Resort for the annual Fuji Rock Festival. The three-day event, the largest outdoor music event in Japan, brings in 200+ artists from around the world and shows them off across seven main stages.","Plus de 100 000 fans se présentent à la Naeba Ski Resort pour le Festival annuel Fuji Rock. L'événement de trois jours, le le plus grand événement de musique en plein air au Japon, amène 200+ artistes de le monde et les montre à travers sept étapes principales.",Naeba Ski Resort,Niigata,Japan,8,JP
Great South Bay Music Festival 2025,https://www.musicfestivalwizard.com/festivals/great-south-bay-music-festival-2025/,https://www.musicfestivalwizard.com/wp-content/uploads/2012/04/South_Bay_Logo.jpg,2025-07-24,2025-07-27,"Taking place on New York’s Long Island, Great South Bay Music Festival combines a love for jambands and pirates at waterfront Shorefront Park. Over a three-day weekend, the festival features performances by jazz, rock, country and funk artists. Great South Bay Music Festival also holds the title as Long Island’s longest running music and arts festival.","Se déroulant sur new de York île, grand Sud Bay Music Festival combine un amour pour les jambands et Pirates à Waterfront Shorefront Park. Au cours d'un week-end de trois jours, le festival le présente des performances d'artistes de funk jazz, rock, country et. Great Sud Bay Music Le festival détient également le titre le le titre Long Island S Festival de musique de course la plus longue et.",Shorefront Park,Patchogue,New York,8,NY
Hills of Rock 2025,https://www.musicfestivalwizard.com/festivals/hills-of-rock-2025/,https://www.musicfestivalwizard.com/wp-content/uploads/2020/01/Hills-of-Rock-Hero.jpg,2025-07-25,2025-07-27,"Known as The City of Seven Hills, the charming Bulgarian city of Plovdiv hosts this heavy metal concert at the end of every July. So crack open a bottle of homemade rakia and head to the Hills of Rock for one of Bulgaria's largest music festivals.","Connu sous le nom de le City de sept collines, The charmant ville bulgare de Plovdiv héberge ce concert de heavy metal à la fin de chaque juillet. Alors ouvrez une bouteille de rakia maison et se dirigez-vous vers le Hills de rock pour l'un des plus grands festivals de musique de Bulgarie.",Rowing Canal,Plovdiv,Bulgaria,8,BG
Junction 2 Festival 2025,https://www.musicfestivalwizard.com/festivals/junction-2-festival-2025/,https://www.musicfestivalwizard.com/wp-content/uploads/2017/12/Junction_2_Festival_Logo.jpg,2025-07-25,2025-07-27,"This London techno festival is held at Boston Manor Park for three days of beats from the genre's top artists. Junction 2 merges the natural beauty of green fields and woodland pathways with striking industrial features that make the site iconic. With a promise of great sound and obsessive attention to detail along with a no VIP policy, this festival continues its fantastic journey.","This London Techno Festival a lieu au Boston Manor Park pour trois jours de battements de les meilleurs artistes du genre. Junction 2 Merges la beauté naturelle des champs verts et Pathways Woodland avec des caractéristiques industrielles frappantes qui font le site emblématique. Avec une promesse d'un grand son et une attention obsessionnelle aux détails avec une politique sans VIP, ce festival continue son voyage fantastique.",Boston Manor Park,London,United Kingdom,8,UK
K-Days 2025,https://www.musicfestivalwizard.com/festivals/k-days-2025/,https://www.musicfestivalwizard.com/wp-content/uploads/2025/05/K-Days-2025-Lineup-Poster.jpg,2025-07-18,2025-07-27,,,Edmonton EXPO Centre & Exhibition Grounds,Edmonton,Alberta,8,AB
Latitude Festival 2025,https://www.musicfestivalwizard.com/festivals/latitude-festival-2025/,https://www.musicfestivalwizard.com/wp-content/uploads/2009/03/latitude_w-e1474109537644.jpg,2025-07-24,2025-07-27,"The pioneering Latitude festival is of the UK's favorite mega-festivals. The world class lineup is mixed with comedy, literature, poetry, and theater -- all set in the fairytale setting of Henham Park in the Suffolk countryside. One of the highlights of the festival season, Latitude is sure to have something for everyone.","Le Festival pionnier latitude est de les méga-festivals préférés du Royaume-Uni. La gamme de classe mondiale la classe mondiale est mélangée avec la comédie, la littérature, la poésie, le théâtre et - tous définis dans the cadre de fées de la campagne du suffolk. One de les des points forts de la saison du festival, latitude est sûr d'avoir quelque chose pour tout le monde.",Henham Park,Suffolk,United Kingdom,8,UK
Liquicity Festival 2025,https://www.musicfestivalwizard.com/festivals/liquicity-festival-2025/,https://www.musicfestivalwizard.com/wp-content/uploads/2018/10/Liquicity_Festival_Logo.jpg,2025-07-25,2025-07-27,"There's drum and there's bass and there's the Dutch Liquicity Festival. Head north from Amsterdam to find huge beats spread across three stages at Geestmerambacht Park. Amusement parks, hot tubs, and volleyball courts are just some of the non-music perks of this wild weekender.","Il y a du tambour et Il y a des basses et Il y a le festival hollandais Liquicity. Dirigez-vous vers le nord de Amsterdam pour trouver d'énormes battements répartis sur trois étapes à Geestmerambacht Park. Les parcs d'amusement, les bains à remous, les terrains de volleyball et ne sont que quelques-uns des avantages les non-musiques de ce Wild Weekender.",Geestmerambacht Parkland,Oudkarspel,Netherlands,8,NL
Low Festival 2025,https://www.musicfestivalwizard.com/festivals/low-festival-2025/,https://www.musicfestivalwizard.com/wp-content/uploads/2014/02/low_festival_logo.jpg,2025-07-25,2025-07-27,"With a recorded 300 sunny a years, you better believe that Benidorm in Spain is more than ready to host this jam packed fest. The annual Low Festival boasts 100% sustainability, proximity to golden beaches, and a killer soundtrack of international bands. There's even an Olympic sized pool at the venue for VIPs (along with unlimited beer).","Avec un 300 Sunny par an, vous feriez mieux de croire que Benidorm en Espagne est plus que prêt à accueillir ce festival de confiture. Le Festival annuel Low possède une durabilité à 100%, la proximité des plages d'or, et une bande-son de bandes internationales. Il y a même une piscine de taille olympique au le pour VIPS (avec de la bière illimitée).",Estadio Municipal Guillermo Amor,Benidorm,Spain,8,ES
Moondance Festival 2025,https://www.musicfestivalwizard.com/festivals/moondance-festival-2025/,https://www.musicfestivalwizard.com/wp-content/uploads/2018/10/Moondance_Festival_Logo.png,2025-07-25,2025-07-27,"Moondance Festival 2024 for its 11th edition expands to 5 events in 2 days: two main nights, boat party and MEETUP! panel. In addition to the two main evenings in the beautiful ambience of the medieval Kamerlengo castle, the program  will also take place on the sea and the beach with 11 international, regional and local performers. This edition of the award-winning festival will present the best of underground techno, combining the best of classic and modern.","Moondance Festival 2024 pour sa 11e édition s'étend à 5 événements en 2 jours: deux nuits principales, Boat Party et Meetup! panneau. En plus de les deux soirées principales dans The Belle ambiance de le Castle médiéval de Kamerlengo, se déroulera également sur le Sea et plage avec 11 International, Regional. This L'édition de le festival primé présentera le Best of Underground Techno, combinant the Best of Classic et Modern.",Kamerlengo Fortress,Trogir,Croatia,8,HR
Newport Folk Festival 2025,https://www.musicfestivalwizard.com/festivals/newport-folk-festival-2025/,https://www.musicfestivalwizard.com/wp-content/uploads/2014/01/Newport_Folk_Fest_Logo.jpg,2025-07-25,2025-07-27,"The 60-year strong Newport Folk Festival takes place annually in Rhode Island and features a lineup of diverse musicians guided by the spirit of kindred folk tradition. The festival has a historic reputation of artists collaborating together on music playing homage to current social justice initiatives. Quickly selling out each year, the Newport Folk Festival is also known `for revealing surprise artists and collaborations.","Le 60 ans Strong newport folk Le festival se déroule chaque année dans le Rhode Island et présente une gamme de musiciens divers guidés par le Spirit de la tradition folklorique. Le festival a une réputation historique d'artistes collaborant ensemble sur la musique en hommage aux initiatives actuelles de la justice sociale. Vendant rapidement chaque année, le Newport folk Le festival est également connu `pour révéler les collaborations surprise et.",Fort Adams State Park,Newport,Rhode Island,8,RI
Out of Space 2025,https://www.musicfestivalwizard.com/festivals/out-of-space-2025/,https://www.musicfestivalwizard.com/wp-content/uploads/2025/03/Out-of-Space-2025-Lineup-Poster.jpg,2025-07-24,2025-07-27,Out of Space is a bespoke concert experience bringing big-name musical acts to the shores of Lake Michigan.,Out de l'espace est une expérience de concert sur mesure apportant des actes musicaux de grand nom aux rives les de lac Michigan.,Illinois Science & Technology Park,Skokie,Illinois,8,IL
Paléo Festival 2025,https://www.musicfestivalwizard.com/festivals/paleo-festival-2025/,https://www.musicfestivalwizard.com/wp-content/uploads/2015/12/Paleo_Festival_Logo.png,2025-07-22,2025-07-27,"Paléo is a major musical event in Europe with six days and six nights of music and shows, spread over seven stages. Both a springboard for young talents and a platform for headliners, Paléo has gradually opened up to all musical styles, as well as to circus and street arts. Particular care is therefore taken in welcoming, decorating and choosing food and craft stands.","Paleo est un événement musical majeur dans Europe avec six jours et six nuits de musique et, réparties sur sept étapes. Un tremplin pour les jeunes talents et Une plate-forme pour les têtes d'affiche, Paleo s'est progressivement ouvert à tous les styles musicaux, ainsi qu'au cirque et Street Arts. Des soins particuliers sont donc pris dans les stands d'artisanat et accueillants et et.",‎Plaine de l'Asse,Nyon,Switzerland,8,CH
Polifonic 2025,https://www.musicfestivalwizard.com/festivals/polifonic-2025/,https://www.musicfestivalwizard.com/wp-content/uploads/2019/03/Polifonic_Logo.jpg,2025-07-23,2025-07-27,It's off to the paradise of Italy's southeastern coast for the cutting-edge electronic sounds of Polifonic. This fairytale boutique festival is one of the dance scene's hidden secrets with idyllic surroundings of olive gardens and beaches.,Il est parti à le paradis de la côte sud-est de l'Italie pour le sons électroniques de pointe de Polifonic. This Fairytale Boutique Festival est l'un des secrets cachés de la scène de danse avec des environs idylliques de jardins d'olive et plages.,Masseria Capece,Valle D'Itria,Italy,8,IT
Poole Harbour Festival 2025,https://www.musicfestivalwizard.com/festivals/poole-harbour-festival-2025/,https://www.musicfestivalwizard.com/wp-content/uploads/2016/08/Vito-Valentinetti-2016-Leefest-34.jpg,2025-07-25,2025-07-27,,,Baiter Park,Poole,United Kingdom,8,UK
Project Pabst 2025,https://www.musicfestivalwizard.com/festivals/project-pabst-2025/,https://www.musicfestivalwizard.com/wp-content/uploads/2014/08/Project_Pabst_2014.jpg,2025-07-26,2025-07-27,The beloved Project Pabst returns to the Portland Waterfront Park for a weekend of music and award winning beer.,Le Beloved Project Pabst revient à le Portland Waterfront Park pour un week-end de musique et Bière primée.,Waterfront Park,Portland,Oregon,8,OR
Red Ants Pants Festival 2025,https://www.musicfestivalwizard.com/festivals/red-ants-pants-festival-2025/,https://www.musicfestivalwizard.com/wp-content/uploads/2016/04/Red_Ants_Pants_Logo.jpg,2025-07-24,2025-07-27,The Red Ants Pants Music Festival. Come connect with good folks and dance your pants off. It's time to celebrate the hard working side of Montana.,Le rouge antts Pants musique festival. Venez vous connecter avec les bonnes personnes et Dancez votre pantalon. Il est temps de célébrer le côté travaillant dur du Montana.,White Sulphur Springs,White Sulphur Springs,Montana,8,MT
Rock Oyster Festival 2025,https://www.musicfestivalwizard.com/festivals/rock-oyster-festival-2025/,https://www.musicfestivalwizard.com/wp-content/uploads/2023/08/Rock-Oyster-Hero.jpg,2025-07-24,2025-07-27,"The Rock Oyster Festival is a three-day voyage of culinary discovery and musical mischief.  The four day-weekend stars incredible talents along with Michelin-starred chefs, alfresco dining, and cooking demonstrations.","Le rock Oyster Le festival est un voyage de trois jours de découverte culinaire et Méfilé musical.  Le Quatre jours-semaines met en vedette des talents incroyables avec des chefs étoilés Michelin, des démonstrations de cuisine en Alfresco, et.",Dinham House,Wadebridge,United Kingdom,8,UK
Rockygrass Festival 2025,https://www.musicfestivalwizard.com/festivals/rockygrass-festival-2025/,https://www.musicfestivalwizard.com/wp-content/uploads/2015/10/Rockygrass_Logo.jpg,2025-07-25,2025-07-27,"'RockyGrass is held at the Planet Bluegrass Ranch in Lyons, Colorado - located along the wooded banks of the beautiful St. Vrain River. The historic quarry town of Lyons is just 15 miles north of Boulder in the foothills of the Rocky Mountains. The town is known for its antique stores, restaurants, artists, and musicians.'","'Rockygrass a lieu à la planète bluegrass ranch à Lyons, Colorado - situé le long de les berges boisées de The Beautiful St. Vrain River. La La ville historique de la ville de Lyons est à seulement 15 miles au nord de Boulder dans les contreforts les de les Rocky Mountains. La ville est connue pour ses magasins d'antiquités, restaurants, artistes, et musiciens. '",Planet Bluegrass Ranch,Lyons,Colorado,9,CO
Salmon Arm Roots & Blues 2025,https://www.musicfestivalwizard.com/festivals/salmon-arm-roots-blues-2025/,https://www.musicfestivalwizard.com/wp-content/uploads/2014/03/RootsBlues_Logo.jpg,2025-07-25,2025-07-27,"Get back to nature with this 25+ year old festival located on picturesque Shuswap Lake in British Columbia. The non-profit Roots & Blues Festival features a culturally diverse lineup, artist experiences, and daytime workshops.","Revenez à la nature avec ce festival vieux de plus de 25 ans situé sur Shuswap pittoresque Lake dans British Columbia. Le sans but lucratif Roots & blues Festival propose une gamme culturellement diversifiée, des expériences d'artistes, et ateliers de jour.",Salmon Arm Roots & Blues Festival,Salmon Arm,British Columbia,9,BC
Standon Calling 2025,https://www.musicfestivalwizard.com/festivals/standon-calling-2025/,https://www.musicfestivalwizard.com/wp-content/uploads/2014/03/Standon_Calling_Logo.jpg,2025-07-24,2025-07-27,"Each summer, Standon Calling tells a new story, bringing their garden party to life with a themed world that has included monsters, the circus, and legends of the lost sees. Across four fun-filled days, you’ll hear music from the acts you love and the very best in emerging talent. Savor incredible food, dance until the early hours, enjoy an abundance of family activities, lounge by the pool, luxuriate in a hot tub, or relax with a massage.","Chaque été, standon Calling raconte une nouvelle histoire, donnant vie à leur jardin avec un monde à thème qui a inclus des monstres, le Circus, et légendes de le Lost Sens. À travers quatre jours amusants, vous entendrez de la musique de le agit que vous aimez et le le meilleur des talents émergents. Savourez de la nourriture incroyable, dansez jusqu'à les premières heures, profitez d'une abondance d'activités familiales, salon par la piscine, luxueuse dans un bain à remous ou détendez-vous avec un massage.",Standon Lordship,Standon,United Kingdom,9,UK
Steelhouse Festival 2025,https://www.musicfestivalwizard.com/festivals/steelhouse-festival-2025/,https://www.musicfestivalwizard.com/wp-content/uploads/2023/09/Steelhouse-Festival-Featured-Image.jpg,2025-07-25,2025-07-27,This 3-day classic rock festival is popular for it's picturesque site and classic rock n roll music since 2011.,This Festival de rock classique de 3 jours est populaire pour son site pittoresque et Musique classique de rock n roll depuis 2011.,Hafod-y-Dafal Farm,Abertillery,United Kingdom,9,UK
Summer Apex 2025,https://www.musicfestivalwizard.com/festivals/summer-apex-2025/,https://www.musicfestivalwizard.com/wp-content/uploads/2024/06/Summer-Apex-Hero-Pic-Editorial-scaled.jpg,2025-07-25,2025-07-27,"GRIDLIFE presents Summer Apex Music & Motorsports Festival.  A full weekend of Racing, Drifting, Music & Car Culture immersed in the lush forests of one of the greatest race tracks in the world, Road America, The National Park of Speed. Join us this July for the inaugural experience.","GridLife présente Summer Apex Music & Motorsports Festival.  Un week-end complet de course, de dérive, musique et de la culture automobile immergée dans les forêts luxuriantes de l'une des les plus grandes pistes de course dans le World, Road America, the national park de la vitesse. Rejoignez-nous en juillet pour The Expérience inaugurale.",Road America,Elkhart Lake,Wisconsin,9,WI
Summer Sound Festival 2025,https://www.musicfestivalwizard.com/festivals/summer-sound-festival-2025-2/,https://www.musicfestivalwizard.com/wp-content/uploads/2023/11/Summer-Sound-Tribute-Music-Festival-Featured-Image.jpg,2025-07-25,2025-07-27,"Summer Sound music festival brings a full weekend of live entertainment from the UK's best tribute bands and artists. Festival goers will enjoy funfair, fireworks, street entertainers, festival stalls, cocktail bars, street food and more.","Summer Sound Le festival de musique apporte un week-end complet de divertissement en direct de les artistes hommage du UK du Royaume-Uni et. Les festivaliers apprécieront Funfair, des feux d'artifice, des artistes de rue, des stands de festival, des bars à cocktails, de la nourriture de rue et plus.",Guisborough Rugby Club,Guisborough,United Kingdom,9,UK
The Big Stomp 2025,https://www.musicfestivalwizard.com/festivals/the-big-stomp-2025/,https://www.musicfestivalwizard.com/wp-content/uploads/2025/02/Big-Stomp-Logo.jpg,2025-07-26,2025-07-27,"The Big Stomp brings two days, three stages, and multiple genres from rock to bluegrass to electronica and beyond to Jones Field nature preserve. Festival fans will enjoy national acts and the best emerging ones too. All proceeds go to The Pete Foundation.","Le big stomp apporte deux jours, trois étapes, et plusieurs genres de roche à bluegrass à electronica et au-delà de jones champ de champ. Les fans du festival apprécieront les actes nationaux et les les meilleurs émergents aussi. All Procéda à la fondation Pete.",Jones Fields Nature Preserve,Louisville,Kentucky,9,KY
The Great Beyond 2025,https://www.musicfestivalwizard.com/festivals/the-great-beyond-2025/,https://www.musicfestivalwizard.com/wp-content/uploads/2023/02/The-Great-Beyond-FI.png,2025-07-25,2025-07-27,Take your place in The Great Beyond…a 3-day experience dedicated to techno and house music.,Prenez votre place dans The Great Beyond… une expérience de 3 jours dédiée à la musique de techno et.,Minnesota River Valley Sanctuary,Franklin,Minnesota,9,MN
Together Again Festival 2025,https://www.musicfestivalwizard.com/festivals/together-again-festival-2025/,https://www.musicfestivalwizard.com/wp-content/uploads/2024/08/Together-Again-2025-Lineup-Poster-2.jpg,2025-07-25,2025-07-27,,,Bolesworth Castle,Chester,United Kingdom,9,UK
Tomorrowland 2025,https://www.musicfestivalwizard.com/festivals/tomorrowland-2025/,https://www.musicfestivalwizard.com/wp-content/uploads/2015/12/Tomorrowland_Logo1.jpg,2025-07-18,2025-07-27,"One of the top electronic music festivals in the world, Tomorrowland in Belgium should be on the bucket list of every festie. It's known for epic stage production along with its insane fireworks displays, and is one of the few festivals in Europe so popular that they hold two editions over two consecutive weekends.","Un de le Top festivals de musique électronique dans le monde le, Tomorrowland en Belgique devrait être sur la liste de chaque festie. Il est connu pour la production de scène épique avec ses affichages de feux d'artifice insensés, et est l'un des les quelques festivals en Europe si populaires qu'ils détiennent deux éditions pendant deux week-ends consécutifs.",De Schorre,Boom,Belgium,9,BE
Toronto’s Festival Of Beer 2025,https://www.musicfestivalwizard.com/festivals/torontos-festival-of-beer-2025/,https://www.musicfestivalwizard.com/wp-content/uploads/2023/03/Torontos-Festival-of-Beer.png,2025-07-25,2025-07-27,,,Bandshell Park at Exhibition Place,Toronto,Ontario,9,ON
