name,url,image,startDate,endDate,description,description_fr,location,city,region,page,region_abbr
Bad Day Music Festival 2025,https://www.musicfestivalwizard.com/festivals/bad-day-music-festival-2025/,https://www.musicfestivalwizard.com/wp-content/uploads/2025/03/Bad-Day-Festival-2025-Lineup-Poster.jpg,2025-07-12,2025-07-12,"It's a good time for a Bad Day. The inaugural installment of BAD Day will feature two outdoor stages that will set the soundtrack with an eclectic mix of bluegrass, funk, reggae, house, and beyond.","C'est un bon moment pour un bad day. Le L'épisode inaugural de BAD Day comportera deux étapes en plein air qui définiront la bande de son avec un mélange éclectique de bluegrass, funk, reggae, house, and Beyond.",Brooklyn Arts District,Wilmington,North Carolina,1,NC
Bayside Festival 2025,https://www.musicfestivalwizard.com/festivals/bayside-festival-2025/,https://www.musicfestivalwizard.com/wp-content/uploads/2023/10/Bayside-Featured-Image.jpg,2025-07-11,2025-07-12,Bayside Festival is a 2-day celebration of music and the peak of summer.,Le festival Bayside est une célébration de 2 jours de la musique et le pic de l'été.,Steam Ferry Park,Helsingborg,Sweden,1,SE
Boogietown 2025,https://www.musicfestivalwizard.com/festivals/boogietown-2025/,https://www.musicfestivalwizard.com/wp-content/uploads/2024/10/Boogietown-Hero.jpg,2025-07-12,2025-07-12,"Boogietown is a disco, soul and funk filled weekender. The festival takes place 35 minutes from London at Apps Court Farm is amongst the bends of the Thames River, ancient woodland, green hills and hidden lakes in the British Countryside.","Boogietown est une disco, soul et funk rempli de semaine. Le festival se déroule à 35 minutes de Londres à Apps Court Farm fait partie de la rivière les de The Thames River, Ancient Woodland, Green Hills et Countryside.",Apps Court Farm,London,United Kingdom,1,UK
Clout 2025,https://www.musicfestivalwizard.com/festivals/clout-2025/,https://www.musicfestivalwizard.com/wp-content/uploads/2025/04/Clout-Featured-Image.jpg,2025-07-11,2025-07-12,"'CLOUT Festival presented by JD is the only Polish festival focused on the global rap scene. Two days filled with top-shelf rap, without division into categories. The CLOUT line-up consists of the most influential foreign artists of contemporary hip-hop: from headliners to newcomers.'","'Festival d'influence présenté par JD est le Festival polonais axé sur la scène du rap global la. Deux jours remplis de rap haut de gamme, sans division en catégories. La gamme d'influence se compose de les artistes étrangers les plus influents du hip-hop contemporain: des têtes d'affiche aux nouveaux arrivants.",Bemowo Airport,Warsaw,Poland,1,PL
Dreamstate Chicago 2025,https://www.musicfestivalwizard.com/festivals/dreamstate-chicago-2025/,https://www.musicfestivalwizard.com/wp-content/uploads/2025/04/Dreamstate-Chicago-2025-Lineup-Poster.jpg,2025-07-12,2025-07-12,Dreamstate heads to Chicago for this small event.,DreamState se dirige vers Chicago pour ce petit événement.,Radius,Chicago,Illinois,1,IL
Jeezum Crow Festival 2025,https://www.musicfestivalwizard.com/festivals/jeezum-crow-festival-2025/,https://www.musicfestivalwizard.com/wp-content/uploads/2024/03/Jeezum-Crow-Festival-2024-Lineup-Poster.jpg,2025-07-11,2025-07-12,"The intimate Jeezum Crow Festival is an annual festival loved by many. The Stateside Amphitheater is a 3000 person capacity outdoor venue which is made up of an orchestra pit, 750 stadium seats, and a grassy lawn.  ADA seating is available on all levels of the venue.","Le intime Jeezum Crow Le festival est un festival annuel aimé de beaucoup. Le L'amphithéâtre à États est un lieu extérieur à une capacité de 3000 personnes qui est composé d'une fosse d'orchestre, 750 sièges de stade, et une pelouse herbeuse.  Les sièges ADA sont disponibles à tous les niveaux du lieu le.",Stateside Amphitheater,Jay,Vermont,1,VT
Kaleidoscope Festival 2025,https://www.musicfestivalwizard.com/festivals/kaleidoscope-festival-2025/,https://www.musicfestivalwizard.com/wp-content/uploads/2023/12/Kaleidoscope-Hero.jpg,2025-07-12,2025-07-12,"At Kaleidoscope festival you will have panoramic views across the whole city, as well as the chance to explore hidden corners of the historic Palace and 196 acres of award-winning Park. The festival is quickly becoming a must experience for music lovers, families and performers, partying their way through London’s summertime.","Au Kaleidoscope Festival, vous aurez des vues panoramiques sur la ville entière, ainsi que la chance d'explorer les coins cachés de le palais historique et 196 acres de prime parc. Le festival le devient rapidement une expérience incontournable pour les mélomanes, les familles et, faisant la fête à travers l'été de Londres.",Alexandra Palace Park,London,United Kingdom,1,UK
Kubix 2025,https://www.musicfestivalwizard.com/festivals/kubix-2025/,https://www.musicfestivalwizard.com/wp-content/uploads/2023/09/Kubix-Featured-Image.jpg,2025-07-12,2025-07-12,"Kubix features two big stages of fantastic live music, on the Main Outdoor Stage and Big Top Dance Arena, plus lots of bars, loads of food stalls with cuisine from across the globe and attractions and rides. There's something for everyone at this festival.","Kubix features two big stages of fantastic live music, on the Main Outdoor Stage and Big Top Dance Arena, plus lots of bars, loads of food stalls with cuisine from across the globe and attractions and Rides. Il y a quelque chose pour tout le monde dans ce festival.",Herrington Park,Sunderland,United Kingdom,1,UK
Lakefront Music Fest 2025,https://www.musicfestivalwizard.com/festivals/lakefront-music-fest-2025/,https://www.musicfestivalwizard.com/wp-content/uploads/2022/07/Lakefront-Hero.jpg,2025-07-11,2025-07-12,Friday night is rock night and Saturday night is country night at the Lakefront Music Fest 2022 in Minnesota.,Vendredi soir est la soirée rock et samedi soir est la soirée country à The Lakefront Music Fest 2022 en Minnesota.,Lakefront Park,Prior Lake,Minnesota,1,MN
Lallycooler 2025,https://www.musicfestivalwizard.com/festivals/lallycooler-2025/,https://www.musicfestivalwizard.com/wp-content/uploads/2025/04/Lallycooler-2025-Lineup-Poster.jpg,2025-07-11,2025-07-12,,,Great Bear Ski Valley,Sioux Falls,South Dakota,1,SD
Lost in Dreams Festival 2025,https://www.musicfestivalwizard.com/festivals/lost-in-dreams-festival-2025/,https://www.musicfestivalwizard.com/wp-content/uploads/2024/07/Lost-In-Dreams-Logo.jpg,2025-07-11,2025-07-12,"The Lost in Dreams Festival will transform downtown Los Angles and surrounding area into a transcendental space where visitors can experience a dreamworld come to life. Expect three stages of bass, dubstep, and dance music.","Le perdu dans Dreams Festival transformera le centre-ville de Los Angles et la zone environnante en un espace transcendantal où les visiteurs peuvent vivre un monde de rêve. Attendez-vous à trois étapes de la basse, dubstep, et de la musique de danse.",LA State Historic Park,Los Angeles,California,1,CA
Lost Minds Festival 2025,https://www.musicfestivalwizard.com/festivals/lost-minds-festival-2025/,https://www.musicfestivalwizard.com/wp-content/uploads/2024/06/Lost-Minds-Hero.jpg,2025-07-12,2025-07-12,"Lost Minds promises to be the ultimate EDM, trance and hardstyle festival in the northeast of the UK.","Perdu Minds promet d'être le EDM ultime, transe et Festival hardstyle dans le nord-est de le uk.",Exhibition Park,Newcastle,United Kingdom,1,UK
Pendleton Whisky Music Fest 2025,https://www.musicfestivalwizard.com/festivals/pendleton-whisky-music-fest-2025/,https://www.musicfestivalwizard.com/wp-content/uploads/2021/12/Pendleton-Whisky-Music-Fest-Hero.jpg,2025-07-12,2025-07-12,It's one big day of whiskey and country and rock at the Pendleton Whisky Music Fest.,C'est un grand jour de whisky et country and rock at the Pendleton whisky musique fest.,Pendleton Round Up Stadium,Pendleton,Oregon,1,OR
Pleasantville Music Festival 2025,https://www.musicfestivalwizard.com/festivals/pleasantville-music-festival-2025/,https://www.musicfestivalwizard.com/wp-content/uploads/2023/01/Pleasantville-Music-Festival.jpg,2025-07-12,2025-07-12,"Pleasantville Music Festival is for lovers of live, world-class rock, food and drinks. There will be a beer & wine garden for the adults, fun activities to keep the kids happy, and a zero-waste program to keep the Earth happy. Plus stuff to buy, charities to learn about, and a warm, positive backyard vibe all combined with world-class headliners, breakout stars and local artists, hand-picked by dedicated music fans.","Pleasantville Music Le festival est destiné aux amateurs de boissons en direct, de classe mondiale, de nourriture et. Il y aura un jardin de bière et de vin pour les adultes, des activités amusantes à garder les enfants heureux, et un programme de déchets zéro pour garder la terre heureuse. Plus des choses à acheter, des organismes de bienfaisance à apprendre, et Une ambiance de arrière-cour chaleureuse et positive combinée avec des têtes d'affiche de classe mondiale, des stars en petits groupes et artistes locaux, sélectionnés à la main par des fans de musique dédiés.",Parkway Field,Pleasantville,New York,1,NY
Reggae On The Way 2025,https://www.musicfestivalwizard.com/festivals/reggae-on-the-way-2025/,https://www.musicfestivalwizard.com/wp-content/uploads/2025/06/Reggae-On-The-Way-2025-Lineup-Poster.jpg,2025-07-12,2025-07-12,"This annual reggae inspired festival showcases a rich tapestry of reggae genres, from roots to dancehall, Hawaiian, and American reggae in the stunning backdrop of the Pacific Northwest.","This Festival annuel inspiré du reggae met en valeur une riche tapisserie de genres de reggae, des racines à dancehall, hawaïen, et reggae américain dans le en arrière-plan étonnant de le Pacifique nord-ouest.",LeMay ACM Haub Field,Tacoma,Washington,1,WA
Rockin’ Thunder Fest 2025,https://www.musicfestivalwizard.com/festivals/rockin-thunder-fest-2025/,https://www.musicfestivalwizard.com/wp-content/uploads/2025/03/Rockin-Thunder-2025-Lineup-Poster.jpg,2025-07-11,2025-07-12,,,Exhibition Lands Racetrack,Edmonton,Alberta,1,AB
Subset Festival 2025,https://www.musicfestivalwizard.com/festivals/subset-festival-2025/,https://www.musicfestivalwizard.com/wp-content/uploads/2025/05/Subset-Festival-2025-Lineup-Poster.png,2025-07-12,2025-07-12,,,Tägi,Wettingen,Switzerland,1,CH
The Peacock Society 2025,https://www.musicfestivalwizard.com/festivals/the-peacock-society-2025/,https://www.musicfestivalwizard.com/wp-content/uploads/2018/03/The_Peacock_Society_Logo.png,2025-07-11,2025-07-12,"One of the most famous electronic festivals in France, The Peacock Society brings 25,000 attendees to the beautiful Parc Floral de Paris.","One de les festivals électroniques les plus célèbres en France, The Peacock La société amène 25 000 participants à The Beautiful Parc Floral de Paris.",Parc Floral de Paris,Paris,France,1,FR
Werchter Boutique 2025,https://www.musicfestivalwizard.com/festivals/werchter-boutique-2025/,https://www.musicfestivalwizard.com/wp-content/uploads/2018/11/Werchter_Boutique.png,2025-07-12,2025-07-12,"Unlike its wilder older sibling (the legendary Rock Werchter Festival), Werchter Boutique is a breath of relaxing fresh air. Only taking place over a single day, this is a festival for connoisseurs who value quality over quantity -- or who simply need a warmup for the massive four-day festival on the horizon.","Contrairement à son frère plus âgé plus sauvage (le légendaire rock Werchter festival), werchter Boutique est une bouffée d'air frais relaxant. Ne se déroulant qu'en une seule journée, il s'agit d'un festival pour les connaisseurs qui apprécient la qualité par rapport à la quantité - ou qui ont simplement besoin d'un échauffement pour le Festival massif de quatre jours sur l'horizon.",Festivalpark,Werchter,Belgium,1,BE
Wobble Coliseum 2025,https://www.musicfestivalwizard.com/festivals/wobble-coliseum-2025/,https://www.musicfestivalwizard.com/wp-content/uploads/2025/04/Wobble-Coliseum-2025-Lineup-Poster.jpg,2025-07-11,2025-07-12,"Wobble Coliseum 4 is Back with Big Gigantic, Zingara, Ganja White Night and more!","Wobble Coliseum 4 est back avec big gigantesque, zingara, ganja blanc nuit et plus!",Hampton Coliseum,Hampton,Virginia,2,VA
A State Of Trance London 2025,https://www.musicfestivalwizard.com/festivals/a-state-of-trance-london-2025/,https://www.musicfestivalwizard.com/wp-content/uploads/2025/03/A-State-of-Trance-London-2025-Lineup-Poster.jpg,2025-07-13,2025-07-13,,,Silverworks Island,London,United Kingdom,2,UK
Also Festival 2025,https://www.musicfestivalwizard.com/festivals/also-festival-2025/,https://www.musicfestivalwizard.com/wp-content/uploads/2023/05/Also-Festival-Featured-Image.jpg,2025-07-11,2025-07-13,"ALSO is the multi award-winning Warwickshire festival set in a stunning Capability Brown landscape for festival-goers to explore, swim, relax and let ideas run wild. Curious, clever and creative, ALSO collabs with the UK’s best experts, authors and speakers as well as offering a highly curated, exquisitely produced programme of talks, panels, immersive events, comedy, music, wellness and adventures in food.","Est également le Festival multi-primes du Warwickshire se déroulant dans un paysage brun à capacité époustouflante pour les festivaliers pour explorer, nager, se détendre et Laissez les idées se déchaîner. CRIATIF CURIEUX, CLIVERS et, collabore également avec les les meilleurs experts du Royaume-Uni, des auteurs et et offrant un programme de pourparlers, de comédie, de musique, de musique, de bien-être très bien organisée et dans la nourriture.",Park Farm,Warwickshire,United Kingdom,2,UK
Audioriver 2025,https://www.musicfestivalwizard.com/festivals/audioriver-2025/,https://www.musicfestivalwizard.com/wp-content/uploads/2015/04/Audioriver_Logo.jpg,2025-07-11,2025-07-13,"'The three-day Audioriver festival is the perfect event for anyone interested in upfront, quality electronic music. In the past ten years the event has hosted hundreds of artists from all over the world, who have performed either on the picturesque beach or in Plock’s Old Market Square. More than a 175,000 punters from all parts of the World have visited the fest, while the last edition gathered over 25,000 people.'","'Le Le festival Audioriver Audioriver est l'événement parfait pour toute personne intéressée par la musique électronique de qualité. Dans le dix dernières années l'événement a hébergé des centaines d'artistes de partout le monde, qui ont joué soit sur la plage pittoresque ou dans le vieux marché de Plock carré. Plus de 175 000 parieurs de toutes les parties de le monde ont visité le fest, tandis que The la dernière édition a rassemblé plus de 25 000 personnes. '",Łódzkie Błonia,Łódź,Poland,2,PL
Awakenings Summer Festival 2025,https://www.musicfestivalwizard.com/festivals/awakenings-summer-festival-2025/,https://www.musicfestivalwizard.com/wp-content/uploads/2015/01/Awakenings_Logo.jpg,2025-07-11,2025-07-13,"After a successful debut, the epic Awakenings Festival returns with a spectacular, summertime camping experience not to be missed. Featuring the best of European techno and dance artists, this is an incredible introduction into the Dutch festival scene.","Après un début réussi, le Epic awakenings redonne avec une expérience de camping estivale spectaculaire à ne pas manquer. Avec le Best of European Techno and Dance Artists, c'est une introduction incroyable dans la scène du festival néerlandais The.",Hilvarenbeek,Hilvarenbeek,Netherlands,2,NL
Bospop 2025,https://www.musicfestivalwizard.com/festivals/bospop-2025/,https://www.musicfestivalwizard.com/wp-content/uploads/2021/12/Bospop-Hero.jpg,2025-07-11,2025-07-13,"Bospop is an old-fashioned cozy pop-rock festival that has existed since 1980. It started as a small-scale festival for amateur bands in particular, but has since grown into a music spectacle with bands of international allure.","Bospop est un festival pop-rock confortable à l'ancienne qui existe depuis 1980. Il a commencé comme un festival à petite échelle pour les groupes amateurs en particulier, mais est devenu depuis un spectacle de musique avec des groupes d'attrait international.",Weert Noord,Weert,Netherlands,2,NL
BRT Roadtrip 2025,https://www.musicfestivalwizard.com/festivals/brt-roadtrip-2025/,https://www.musicfestivalwizard.com/wp-content/uploads/2025/03/BRT-Weekend-2025-Lineup-Poster.jpg,2025-07-11,2025-07-13,Beach Road Trip Weekend was created in 2012 and is inspired by Caribbean culture.,Beach road trip Weekend a été créé en 2012 et est inspiré par la culture des Caraïbes.,Goldfish Beach Club,Atlantic City,New Jersey,2,NJ
Cactus Festival 2025,https://www.musicfestivalwizard.com/festivals/cactus-festival-2025/,https://www.musicfestivalwizard.com/wp-content/uploads/2016/03/Cactus_Festival_Logo.png,2025-07-11,2025-07-13,"Cactusfestival in Bruges keeps it simple with only a single stage to help fans avoid dreaded schedule conflicts and an intimate experience, only allowing an attendance of 25,000. Focused on rock and alternative music, Cactusfestival has been delivering this intimate vibe since 1982.","Cactusfestival dans Bruges reste simple avec une seule étape pour aider les fans à éviter les conflits de calendrier redoutés et une expérience intime, ne permettant qu'une présence de 25 000. Focus sur la musique alternative rock et, Cactusfestival fournit cette ambiance intime depuis 1982.",Minnewaterpark,Brugge,Belgium,2,BE
Dead of Summer Festival 2025,https://www.musicfestivalwizard.com/festivals/dead-of-summer-2025/,https://www.musicfestivalwizard.com/wp-content/uploads/2025/01/Dead-of-Summer-2025-Lineup-Poster.jpg,2025-07-11,2025-07-13,Calling all hippies! Vermont is the ideal place to celebrate the Grateful Dead and you can enjoy a wonderful camping weekend of jam music and good times.,Appel Tous les hippies! Vermont est le lieu idéal pour célébrer le reconnaissant mort et Vous pouvez profiter d'un merveilleux week-end de camping de la musique de jam et de bons moments.,Hunter Park,Manchester,Vermont,2,VT
Electric Bay 2025,https://www.musicfestivalwizard.com/festivals/electric-bay-2025/,https://www.musicfestivalwizard.com/wp-content/uploads/2025/01/Electric-Bay-Hero.jpg,2025-07-12,2025-07-13,This open air dance music festival hosts two days of dance music and notable production.,This Festival de musique de danse en plein air accueille deux jours de musique de danse et Production notable.,Torre Abbey Meadows,Torquay,United Kingdom,2,UK
Four Winds Music Fest 2025,https://www.musicfestivalwizard.com/festivals/four-winds-music-fest-2025/,https://www.musicfestivalwizard.com/wp-content/uploads/2024/07/Four-Winds-Featured-Image.jpg,2025-07-11,2025-07-13,Four Winds Music Fest is a 3-day music festival showcasing artists from diverse cultural backgrounds and various musical genres. This family-friendly festival takes place at Riverstone Retreat.,Quatre Winds Music Fest est un festival de musique de 3 jours présentant des artistes de divers horizons culturels et divers genres musicaux. This Festival familial a lieu à Riverstone Retreat.,Riverstone Retreat,Durham,Ontario,2,ON
Les Nuits Secrètes 2025,https://www.musicfestivalwizard.com/festivals/les-nuits-secretes-2025/,https://www.musicfestivalwizard.com/wp-content/uploads/2018/10/Les_Nuits_Secretes_Logo.jpg,2025-07-11,2025-07-13,"For three days, the tiny town of Aulnoye-Aymeries (1 hour away from Lille) is filled with 45,000 festies. The secret of this festival? More than 70 concerts and secret shows at one of the most reasonable prices of the summer. Lots of big names for a great price at Secret Nights.","Pour Trois jours, la La petite ville d'Aulnoye-Aymeries (à 1 heure de Lille) est remplie de 45 000 festivités. Le secret de ce festival? Plus de 70 concerts et Secret montre à l'un des prix les plus raisonnables de le. Beaucoup de grands noms à un prix avantageux à secret nuits.",Various Venues,Aulnoye-Aymeries,France,2,FR
Levitate Festival 2025,https://www.musicfestivalwizard.com/festivals/levitate-festival-2025/,https://www.musicfestivalwizard.com/wp-content/uploads/2017/01/Levitate-Logo-e1484826297913.jpg,2025-07-12,2025-07-13,"This grassroots music and arts festival features roots, reggae, folk, rock, and funk. The organizers, a community oriented surf/skate shop, started the festival as an anniversary party in 2013, but it became such a success, it’s now an annual New England event. Held just 30 minutes south of Boston, the festival is an excellent reason to get out of the city for the weekend!","This Musique de base et Arts Festival présente des racines, reggae, folk, rock, et funk. The Organisateurs, une boutique de surf / skate axée sur la communauté, a commencé le festival en tant que fête d'anniversaire en 2013, mais c'est devenu un tel succès, c'est maintenant un événement annuel nouveau en Angleterre. Tenu à seulement 30 minutes au sud de Boston, The Festival est une excellente raison de sortir de la ville la pour le week-end!",Marshfield Fair Grounds,Marshfield,Massachusetts,2,MA
Lollapalooza Berlin 2025,https://www.musicfestivalwizard.com/festivals/lollapalooza-berlin-2025/,https://www.musicfestivalwizard.com/wp-content/uploads/2015/10/Lollapalooza_Logo.jpg,2025-07-12,2025-07-13,"Since its inception in 1991, Lollapalooza has continued to grow from it’s U.S. based festival circuit to additional cities in countries across the globe. As the first European city to host Lollapalooza outside of the U.S., Berlin began its entrance into the Lollapalooza festival tour in 2015, and has since grown to over 70,000 attendees.","Depuis sa création en 1991, lollapalooza a continué de se développer à partir de son circuit de festival basé aux États-Unis vers des villes supplémentaires dans des pays de le globe. Comme le Première ville européenne pour héberger lollapalooza en dehors de the U.S., Berlin a commencé son entrée dans le festival The a depuis grandi au cours de la tournée de 70 000.",Olympiapark Berlin,Berlin,Germany,2,DE
Love Family Park 2025,https://www.musicfestivalwizard.com/festivals/love-family-park-2025/,https://www.musicfestivalwizard.com/wp-content/uploads/2015/12/Love_Family_Park_2016_Logo.jpg,2025-07-12,2025-07-13,"Love Family Park takes place in Rebstockpark. The single day festival is a techno lover's dream with music running from morning until sunset, dipping into all the sub-genres along the way. Huge names lead the lineup, but festies have a chance to see some of the real up and comers of the scene at Love Family Park.","Love famille Park se déroule dans RebstockPark. The Festival en une seule journée est le rêve d'un amant techno avec de la musique allant du matin au coucher du soleil, plongeant dans tout les sous-genres le long de la voie. Énormes noms mènent la gamme, mais les fêtes ont une chance de voir certains des la scène réel et de la scène à Love famille Park.",Rebstockpark,Frankfurt,Germany,2,DE
Mosswood Meltdown 2025,https://www.musicfestivalwizard.com/festivals/mosswood-meltdown-2025/,https://www.musicfestivalwizard.com/wp-content/uploads/2019/11/Vito-Valentinetti-Parkpop-2019-19.jpg,2025-07-12,2025-07-13,"Hosted by filmmaker John Waters, Burger Boogaloo is an eclectic music festival quoted by Waters himself as 'the perfect cult gathering of young and old music rebels who hate everybody in the world except each other.' The festival is hosted at the historic Mosswood Park in Oakland, California and has been on the festival circuit for over a decade.","Hébergé par le cinéaste John Waters, Burger Boogaloo est un festival de musique éclectique cité par Waters lui-même en tant que 'le rassemblement culte parfait de Young and Old Music Rebels qui déteste tout le monde dans le monde sauf les uns les autres.' Le festival est hébergé à The historique Mosswood Park à Oakland, Californie et est sur le circuit de festival le depuis plus d'une décennie.",Mosswood Park,Oakland,California,2,CA
Mostly Jazz Funk & Soul Festival 2025,https://www.musicfestivalwizard.com/festivals/mostly-jazz-funk-soul-festival-2025/,https://www.musicfestivalwizard.com/wp-content/uploads/2023/05/Mostly-Jazz-Funk-Soul-2023-Featured-Image.jpg,2025-07-11,2025-07-13,"'A diverse, vibrant festival, celebrating ground-breaking, innovative UK music alongside international trailblazers. Showcasing unsigned acts right next to well-established international artists makes for a really exciting bill. We’re a festival for all, having one of the most diverse festival crowds with plenty for you to discover.'","«Un festival diversifié et dynamique, célébrant la musique britannique innovante et révolutionnaire aux côtés des pionniers internationaux. Présenter des actes non signés juste à côté d'artistes internationaux bien établis constitue un projet de loi vraiment excitant. Nous sommes un festival pour tous, ayant l'un des le les foules de festival les plus diversifiées avec beaucoup de choses à découvrir.",Moseley Park,Birmingham,United Kingdom,2,UK
