name,url,image,startDate,endDate,description,description_fr,location,city,region,page,region_abbr
Tension Festival 2025,https://www.musicfestivalwizard.com/festivals/tension-festival-2025/,https://www.musicfestivalwizard.com/wp-content/uploads/2024/02/Tension-Festival-Hero.jpg,2025-07-31,2025-08-02,"Tension is a 3-day electronic music festival held in Basel, Switzerland.","Tension est un festival de musique électronique de 3 jours qui s'est tenu à Bâle, en Suisse.",Sankt Jakobs-Strasse,Basel,Switzerland,11,CH
Terp Float Fest 2025,https://www.musicfestivalwizard.com/festivals/terp-float-fest-2025/,https://www.musicfestivalwizard.com/wp-content/uploads/2025/03/Terp-Float-Festival-2025-Lineup-Poster.jpg,2025-07-31,2025-08-02,"Terp Float Fest is set to be a vibrant celebration of music, community, and cannabis culture on the scenic banks of the Illinois River in Tahlequah, Oklahoma.","Terp float fest est considéré comme une célébration vibrante de la musique, la communauté, et Culture de cannabis sur The Banks scenic de the Illinois River in Tahlequah, Oklahoma.",Sparrowhawk Camp,Tahlequah,Oklahoma,11,OK
Wacken 2025,https://www.musicfestivalwizard.com/festivals/wacken-2025/,https://www.musicfestivalwizard.com/wp-content/uploads/2011/02/WackenOpenAirLogo.jpg,2025-07-30,2025-08-02,"It's been dubbed The Mecca of Heavy Metal Culture. For three days in August, the population of the tiny town of Wacken swells from 2,000 to 75,000 for this annual gathering of German metalheads. This monster of a festival started off small in 1990 as a showcase for local bands, but has become a juggernaut of the metal festival scene.","Il a été surnommé la Mecque de la culture lourde métal. Pour Trois jours en août, la population de la petite ville de wacken gonfle de 2000 à 75 000 pour ce rassemblement annuel de têtes métalliques allemandes. This Le monstre d'un festival a commencé petit en 1990 en tant que vitrine pour les groupes locaux, mais est devenu un mastodonte de la scène du festival de métal The.",Wacken,Wacken,Germany,11,DE
Weekend Festival Finland 2025,https://www.musicfestivalwizard.com/festivals/weekend-festival-finland-2025/,https://www.musicfestivalwizard.com/wp-content/uploads/2015/04/Weekend_Festival_Logo.jpg,2025-08-01,2025-08-02,"Started back in 2012, this one of the wildest electronic parties Northern Europe. 40000 festies shop up to dance to  EDM, house, techno, and even some pop. This year, Weekend moves to its new home at at Suvilahti, a former energy production area in Helsinki.","A commencé en 2012, celui-ci de les parties électroniques les plus sauvages Northern Europe. 40000 festivités achètent pour danser pour EDM, House, Techno, et Même un peu de pop. This année, week-end se déplace vers sa nouvelle maison à Suvilahti, une ancienne zone de production énergétique à Helsinki.",Suvilahti,Helsinki,Finland,11,FI
Wildlands Festival Big Sky 2025,https://www.musicfestivalwizard.com/festivals/wildlands-festival-big-sky-2025/,https://www.musicfestivalwizard.com/wp-content/uploads/2022/10/Wildlands-Festival-Hero.jpg,2025-08-01,2025-08-02,"Wildlands Festival takes place at the Big Sky Events Arena in Big Sky, Montana with the iconic Lone Peak as the backdrop. The two-evening line-up will celebrate the wildlands and incredible spaces that surround us through music and personal connection.","Wildlands Festival a lieu à The Big Sky Events Arena dans Big Sky, Montana avec The emblématique pic lone comme le en arrière-plan. La gamme de deux deux ans célébrera les Wildlands et des espaces incroyables qui nous entourent à travers la musique et connexion personnelle.",Big Sky Events Arena,Big Sky,Montana,11,MT
Xtreme Fest 2025,https://www.musicfestivalwizard.com/festivals/xtreme-fest-2025/,https://www.musicfestivalwizard.com/wp-content/uploads/2018/12/Vito-Valentinetti-Electric-Fields-2018-1.jpg,2025-07-31,2025-08-02,It's punk rock with your Xtreme family in France. This three-day festival brings the punk to Europe.,C'est punk rock avec votre famille xtreme en France. This Festival de trois jours apporte le punk à Europe.,Cap'Découverte,Tarn,France,11,FR
All Together Now Festival 2025,https://www.musicfestivalwizard.com/festivals/all-together-now-festival-2025/,https://www.musicfestivalwizard.com/wp-content/uploads/2018/02/All_Together_Now_Logo.jpg,2025-07-31,2025-08-03,"In a lush setting steeped in beauty, drama and history is the second chapter of All Together Now. This August Bank Holiday festival offers a weekend of freedom and escapism through music, spoken word, comedy, theater, debate, art and workshops.","Dans un cadre luxuriant imprégné de beauté, le théâtre et est le deuxième chapitre de all ensemble maintenant. This Le festival des vacances bancaires d'août propose un week-end de liberté et Évasion à travers la musique, la parole parlée, la comédie, le théâtre, le débat, l'art et ateliers.",Curraghmore Estate,Waterford,Ireland,11,IE
Area 506 2025,https://www.musicfestivalwizard.com/festivals/area-506-2025/,https://www.musicfestivalwizard.com/wp-content/uploads/2025/03/Area-506-Featured-Image.jpg,2025-08-01,2025-08-03,"Area 506 festival celebrates the best of New Brunswick music,Area 506, and goods. Since 2016, they've been bringing live music on the Saint John waterfront.","Area 506 Festival célèbre le le meilleur de new Brunswick Music, Area 506, et Produits. Depuis 2016, ils apportent de la musique live sur The Saint John Waterfront.",Area 506,Saint John,New Brunswick,11,NB
Arenal Sound 2025,https://www.musicfestivalwizard.com/festivals/arenal-sound-2025/,https://www.musicfestivalwizard.com/wp-content/uploads/2014/01/Arenal_Sound_Logo.jpg,2025-07-30,2025-08-03,"Held right on the beach in the super sunny east of Spain, the open-air Arenal Sound Festival takes place in the coastal town of Borianna. Indie music in all its various forms (pop, rock, hip-hop, and electronic) plays over a whopping six days to 250,000 festies.","Tenu à droite sur la plage dans le super ensoleillé à l'est de l'Espagne, le en plein air arenal Sound Festival se déroule dans la ville côtière de Borianna. La musique indépendante dans toutes ses différentes formes (pop, rock, hip-hop, et électronique) joue sur six jours à 250 000 fêtes.",Acampada Malvarrosa Arenal Sound,Borianna,Spain,11,ES
Back Cove Music Festival 2025,https://www.musicfestivalwizard.com/festivals/back-cove-music-festival-2025/,https://www.musicfestivalwizard.com/wp-content/uploads/2025/02/Back-Cove-Festival-2025-Lineup-Poster.jpg,2025-08-02,2025-08-03,"Back Cove Music & Arts Festival is Portland, Maine’s premier outdoor music festival, featuring world class artists, local food and drink vendors, and a picturesque location at Payson Park","Back cove music & Arts Festival est Portland, le premier festival de musique extérieur du Maine, avec des artistes de classe mondiale, une cuisine locale et Drink Vendors, et un emplacement pittoresque à Payson parc",Payson Park,Portland,Maine,11,ME
Bears Picnic 2025,https://www.musicfestivalwizard.com/festivals/bears-picnic-2025/,https://www.musicfestivalwizard.com/wp-content/uploads/2025/06/Bears-Picnic-2025-Lineup-Poster.jpg,2025-07-31,2025-08-03,This cozy camping festival in central Pennsylvania features three days of jam music during the first week of August.,This Festival de camping confortable dans le centre de la Pennsylvanie propose trois jours de musique de jam pendant The Première semaine d'août.,Blain Picnic Grounds,Blain,Pennsylvania,11,PA
Big Valley Jamboree 2025,https://www.musicfestivalwizard.com/festivals/big-valley-jamboree-2025/,https://www.musicfestivalwizard.com/wp-content/uploads/2011/11/BVJlogo.jpg,2025-07-31,2025-08-03,"Started in 1993, The Big Valley Jamboree has become a country music institution in Camrose, Alberta. Settle in for three days of hard partying with 75,000 other country music festies -- and make sure to stay in the campgrounds where the real show is happening.","Démarré en 1993, The Big Valley Jamboree est devenu une institution musicale country à Camrose, en Alberta. Installez-vous pendant trois jours de fête avec 75 000 autres fêtes de musique country - et Assurez-vous de rester dans les des terrains de camping où le réel se produit.",Big Valley Jamboree,Camrose,Alberta,11,AB
Bluegrass and Beer Festival 2025,https://www.musicfestivalwizard.com/festivals/bluegrass-and-beer-festival-2025/,https://www.musicfestivalwizard.com/wp-content/uploads/2022/06/Keystone-Hero.jpg,2025-08-02,2025-08-03,"Set at the base of the stunning rocky mountains in Keystone's River Run Village, get ready for some bluegrass, beer, and the beautiful blue skies of Colorado.","Définissez la base de le magnifique Rocky Mountains dans le village de Keystone's River Run, préparez-vous pour du Bluegrass, de la bière, et le Beau Skies bleu du Colorado.",River Run at Keystone Resort,Keystone,Colorado,11,CO
Cambridge Folk Festival 2025,https://www.musicfestivalwizard.com/festivals/cambridge-folk-festival-2025/,https://www.musicfestivalwizard.com/wp-content/uploads/2012/11/Cambridge_Folk_Fest_Logo1-e1352418405901.jpg,2025-07-31,2025-08-03,The Cambridge Folk Festival is one of the premier music events in Europe and one of the longest running and most famous folk festivals in the world.,Le Cambridge folk Le festival est l'un des événements de musique de premier ministre le dans The Europe et les plus célèbres festivals foliques de le plus grand monde.,Cherry Hinton Hall,Cambridge,United Kingdom,11,UK
Cambridge Rock Festival 2025,https://www.musicfestivalwizard.com/festivals/cambridge-rock-festival-2025/,https://www.musicfestivalwizard.com/wp-content/uploads/2015/09/Cambridge_Rock_Festival_Logo_001-e1441922740355.jpg,2025-07-31,2025-08-03,"'A superb Rock Festival featuring mainly Rock and Blues, with added Prog, NWBHM, great food and 70 real ales, ciders, wines and lager! Ben's Yard is adjacent to the site and offers a rural retail village on the beautifully landscaped Stuntney Estate. Boasting an all independent set of retailers, including a cafe, restaurant, butchers, a variety of shops covering fashion, homeware and lifestyle, as well as wildflower trails and a childrens adventure playground styled after Ely Cathedral! The Stuntney (Ely) venue offers great access via trains into Ely station, just 1.4 miles from the site as well as easy assess via the A14 and A10. This site is as always subject to licence, and is currently home to another long established folk festival.'","'Un superbe festival rock mettant en vedette principalement rock et blues, avec un prog, nwbhm, une grande nourriture et 70 allemands, ciders, vins et lager! La cour de Ben est adjacente au site le site et propose un village de vente au détail rural sur le magnifiquement aménagé Sachdney. Bénéficiant d'un ensemble de détaillants entièrement indépendant, notamment un café, un restaurant, des boucheurs, une variété de magasins couvrant la mode, des articles ménagers et, ainsi que des sentiers de fleurs Wildflower et un terrain de jeu d'aventure pour enfants stylisé après la cathédrale! The Stuntney (ely) Le lieu offre un excellent accès via des trains vers la station Ely, à seulement 1,4 miles du site le site ainsi qu'une évaluation facile via le A14 et A10. Ce site est comme toujours soumis à la licence, et abrite actuellement un autre festival folklorique établi depuis longtemps. '",Harlocks Farm,Cambridge,United Kingdom,11,UK
Castlefest 2025,https://www.musicfestivalwizard.com/festivals/castlefest-2025/,https://www.musicfestivalwizard.com/wp-content/uploads/2023/06/Castlefest-Featured-Image.jpg,2025-07-31,2025-08-03,"'Imagine yourself in a completely different world at Castlefest, the Fantasy festival of the Netherlands. A fest for young and old, where, as soon as you enter the gates, you find yourself in the Other World. Castlefest is a total experience with lots of music, fantasy writers, themed catering, medieval crafts and a large market which offers everything a fantasy fan is looking for.'","'Imaginez-vous dans un monde complètement différent à Castlefest, The Festival fantasy de The Pays-Bas. Une fête pour les jeunes et vieux, où, dès que vous entrez les portes, vous vous retrouvez dans le autre monde. Castlefest est une expérience totale avec beaucoup de musique, des écrivains fantastiques, une restauration à thème, des métiers médiévaux et un grand marché qui offre tout ce qu'un fan de fantasy recherche.",Castle Keukenhof,Amsterdam,Netherlands,11,NL
Chasing Summer 2025,https://www.musicfestivalwizard.com/festivals/chasing-summer-2025/,https://www.musicfestivalwizard.com/wp-content/uploads/2017/03/Chasing_Summer_Logo.jpg,2025-08-02,2025-08-03,The largest outdoor EDM event in Western Canada returns to Alberta for this two-day annual electronic fest in August. Take advantage of the last days of summer to party at the Max Bell Centre in Calgary and dance from sunrise to sundown with this jam-packed lineup.,The Le plus grand événement EDM en plein air dans l'Ouest canadien revient en Alberta pour ce festival électronique annuel de deux jours en août. Profitez de le Derniers jours de l'été pour faire la fête à le MAX Bell Center dans Calgary et Dance du lever au soleil avec cette gamme remplie de cars.,Max Bell Centre,Calgary,Alberta,11,AB
Dekmantel Festival 2025,https://www.musicfestivalwizard.com/festivals/dekmantel-festival-2025/,https://www.musicfestivalwizard.com/wp-content/uploads/2016/04/Dekmantel_Logo.png,2025-08-01,2025-08-03,"Dekmantel Festival returns stronger than the ever with a bold 'choose your own adventure' programming that welcomes a broad array of electronic tunes. The Amsterdam based festival takes place at the stunning Amsterdamse Bos, a massive city park oasis inside the city.","Dekmantel Le festival revient plus fort que le avec une programmation audacieuse de choisir votre propre aventure qui accueille un large éventail de morceaux électroniques. Le Amsterdam Le festival basé sur le Festival a lieu à The Amsterdamse Bos, une ville de la ville de la ville massive à l'intérieur de la ville The.",The Amsterdamse Bos,Amsterdam,Netherlands,11,NL
Doune the Rabbit Hole 2025,https://www.musicfestivalwizard.com/festivals/doune-the-rabbit-hole-2025/,https://www.musicfestivalwizard.com/wp-content/uploads/2016/02/Doune_the_Rabbit_Hole_Logo.jpg,2025-08-01,2025-08-03,"'Doune the Rabbit Hole is an intimate, independent music & arts festival located amidst the glorious ancient oak trees of the Cardross Estate, near (Scotland’s ONLY) Lake of Menteith, in Stirlingshire. Started in 2010, at a site near the town of Doune (hence the name!) they have been celebrating the very best of Scotland’s independent/DIY arts scene alongside amazing international guests.'","'Doune The Rabbit Hole est un festival intime et indépendant de musique et d'arts situé au milieu de The Glorious Oak Oak Trees de the Cardross Estate, Near (Scotland's Only) Lake de Menteith, dans Sirlingshire. Démarré en 2010, sur un site près de la ville de Doune (d'où le nom le!) Ils ont célébré The très très bien de la scène des arts indépendants / bricolage d'Écosse aux côtés d'invités internationaux.",Cardross Estate,Stirlingshire,Scotland,12,SC
Faine Misto 2025,https://www.musicfestivalwizard.com/festivals/faine-misto-2025/,https://www.musicfestivalwizard.com/wp-content/uploads/2025/02/Faine-Misto-Featured-Image.jpg,2025-08-01,2025-08-03,Faine Misto is an open-air music festival that has been held annually since 2013.,Faine Misto est un festival de musique en plein air qui a eu lieu chaque année depuis 2013.,"!FESTrepublic, Lviv city",Lviv,Ukraine,12,UA
Family Piknik 2025,https://www.musicfestivalwizard.com/festivals/family-piknik-2025/,https://www.musicfestivalwizard.com/wp-content/uploads/2023/08/Vito-Valentinetti-Family-Piknik-2023-0763.jpg,2025-08-01,2025-08-03,"Bring the kids and your open attitude to the Family Piknik in the south of France. Held near Montpellier, this electronic festival aims to include all ages into the world of underground electronic music.","Apportez les enfants et votre attitude ouverte à le famille piknik dans le au sud de la France. Tenue près de Montpellier, ce festival électronique vise à inclure tous les âges dans le monde le de la musique électronique underground.",Espace Lucien Jean,Frontignan,France,12,FR
Hard Summer 2025,https://www.musicfestivalwizard.com/festivals/hard-summer-2025/,https://www.musicfestivalwizard.com/wp-content/uploads/2015/04/Hard_Summer_Logo1.png,2025-08-02,2025-08-03,Hard Summer takes place in Inglewood's Hollywood Park. This 2-day festival has been exploding with electronic music since its debut in 2008 and has become a staple of the Southern California electronic festival scene.,Hard Summer se déroule à Hollywood d'Inglewood Park. This Festival de 2 jours explose avec de la musique électronique depuis ses débuts en 2008 et est devenu un aliment de base de la scène du festival électronique électronique du sud de la Californie du Sud.,Hollywood Park,Los Angeles,California,12,CA
Hinterland Music Festival 2025,https://www.musicfestivalwizard.com/festivals/hinterland-music-festival-2025/,https://www.musicfestivalwizard.com/wp-content/uploads/2015/10/Hinterland_Logo.jpg,2025-08-01,2025-08-03,"A four-day music festival in the Iowa countryside, Hinterland Music Festival has already hosted a number of world class acts, including Kacey Musgraves, Willie Nelson, Brandi Carlile, Sturgill Simpson, Hozier, Maggie Rogers, TV on the Radio, Dwight Yoakam, and Tyler Childers.","A four-day music festival in the Iowa countryside, Hinterland Music Festival has already hosted a number of world class acts, including Kacey Musgraves, Willie Nelson, Brandi Carlile, Sturgill Simpson, Hozier, Maggie Rogers, TV on the Radio, Dwight Yoakam, et Tyler Childers.",Avenue of the Saints Amphitheater,Des Moines,Iowa,12,IA
Kaslo Jazz Festival 2025,https://www.musicfestivalwizard.com/festivals/kaslo-jazz-festival-2025/,https://www.musicfestivalwizard.com/wp-content/uploads/2024/08/Kaslo-Jazz-Fest-2025-Lineup-Poster.jpg,2025-08-01,2025-08-03,"Kaslo Jazz Etc. Festival is an intimate and laid-back world-class music festival that has been hosting big names and newly discovered ones since 1992. The festival will showcase an array of blues, jazz, latin, folk, world music and much more.  There is a unique floating stage that transforms Kaslo Bay Park into a natural green amphitheater.","Kaslo jazz etc. Le festival est un festival de musique intime et qui héberge de grands noms et de nouveau découverts depuis 1992. Le Festival présentera un argent de blues, de jazz, latin, le folk, le folk, le monde, et.  Il y a une étape flottante unique qui se transforme Kaslo Bay Park en un amphithéâtre vert naturel.",Kaslo Bay Park,Kaslo,British Columbia,12,BC
Kendal Calling 2025,https://www.musicfestivalwizard.com/festivals/kendal-calling-2025/,https://www.musicfestivalwizard.com/wp-content/uploads/2015/03/Kendal_Calling_Logo.jpg,2025-07-31,2025-08-03,"Set in the picturesque Lake District and featuring a giant lineup including huge headliners, Kendal Calling is a true fan favorite of the UK summertime. Move quick, this amazing weekend of music, art, comedy, food, and drink sells out every year.","Défini dans le pittoresque Lake District et avec une gamme géante comprenant d'énormes têtes d'affiche, Kendal Calling est un véritable favori des fans de The UK Summertime. Déplacez-vous vite, ce week-end incroyable de musique, de l'art, de la comédie, de la nourriture, de la boisson et se vend chaque année.",Lowther Deer Park,Cumbria,United Kingdom,12,UK
Lollapalooza Chicago 2025,https://www.musicfestivalwizard.com/festivals/lollapalooza-chicago-2025/,https://www.musicfestivalwizard.com/wp-content/uploads/2015/10/Lollapalooza_Logo.jpg,2025-07-31,2025-08-03,"It’s loud. It’s messy. It’s Lollapalooza. You got to hand it to Perry Farrell, the bizarre and quirky visionary who reinvented the American music festival with Lollapalooza, first taking it on the road in the last century and then putting down stakes in Chicago. Despite a firm homebase in the Windy City, Lolla hasn’t forgotten its traveling roots with editions in South America and Europe.","C'est fort. C'est désordonné. C'est lollapalooza. You got to hand it to Perry Farrell, the bizarre and quirky visionary who reinvented the American music festival with Lollapalooza, first taking it on the road in the last century and then putting Down Stakes dans Chicago. Malgré une base de maison ferme dans The Windy City, Lolla n'a pas oublié ses racines itinérantes avec des éditions en Sud America et Europe.",Grant Park,Chicago,Illinois,12,IL
MADE Festival 2025,https://www.musicfestivalwizard.com/festivals/made-festival-2025/,https://www.musicfestivalwizard.com/wp-content/uploads/2018/03/Made_Festival_Logo.jpg,2025-08-02,2025-08-03,"MADE Festival is held in the UK and features D&B, house, grime and garage. The urban dance and music festival is held at Perry Park in Birmingham.","Le festival Made a lieu dans le uk et dispose du garage d & b, house, grime et. The Urban Dance and Music Festival a lieu à Perry Park à Birmingham.",The Digbeth Triangle,Birmingham,United Kingdom,12,UK
Mammoth Bluesapalooza 2025,https://www.musicfestivalwizard.com/festivals/mammoth-bluesapalooza-2025/,https://www.musicfestivalwizard.com/wp-content/uploads/2021/11/Mammoth-Brews-and-Bluesapalooza-1.png,2025-07-31,2025-08-03,Picture this - you are outdoors among the pines in Mammoth Lakes for four days of incredible music and the 80+ craft breweries. This is Mammoth Lakes’ biggest event and the best party of the summer.,Image ceci - vous êtes à l'extérieur parmi les pins dans mammoth des lacs pour quatre jours de musique incroyable et le 80+ brasseries artisanales. This est mammoth le plus grand événement de lacs et le la meilleure partie de The Summer.,Mammoth Lakes,Mammoth Lakes,California,12,CA
Membrain Festival 2025,https://www.musicfestivalwizard.com/festivals/membrain-festival-2025/,https://www.musicfestivalwizard.com/wp-content/uploads/2018/10/Membrain_Logo.png,2025-07-31,2025-08-03,Europe's heartiest and newest underground bass culture festival takes place on the beautiful shores of the Dalmatian Coast. Relive the vibe of old school raves at this four-day festival.,Europe S FIRFORS et Festival de culture de basse underground se déroule sur les belles rives de le dalmatien Coast. Revivez l'ambiance des délires de la vieille école lors de ce festival de quatre jours.,Minerska Beach,Šibenik,Croatia,12,HR
Mile of Music 2025,https://www.musicfestivalwizard.com/festivals/mile-of-music-2025/,https://www.musicfestivalwizard.com/wp-content/uploads/2021/04/Mile-of-Music-Editorial.jpg,2025-07-31,2025-08-03,"What happens when you combine a vibrant, one-mile stretch of Downtown Appleton, Wisconsin, with 200 up-and-coming artists performing live, FREE 100% original music over four days? You get to experience an unforgettable music-filled weekend with over 900 incredible shows!","Que se passe-t-il lorsque vous combinez un tronçon dynamique d'un mile de Downtown Appleton, Wisconsin, avec 200 vers le haut - et - des artistes à venir jouant en direct, une musique 100% originale gratuite sur quatre jours? Vous découvrez un week-end inoubliable de musique avec plus de 900 spectacles incroyables!",Various Venues,Appleton,Wisconsin,12,WI
Nature One 2025,https://www.musicfestivalwizard.com/festivals/nature-one-2025/,https://www.musicfestivalwizard.com/wp-content/uploads/2012/02/Nature_One_Logo.jpg,2025-07-31,2025-08-03,"For their 25th anniversary, Nature One in Germany is going even bigger than ever with 350 DJs and live acts on over 20 stages. Their 100 hectare campsite promises to be just as insane. Massive stage production, the best talent in the world, German sized campgrounds -- what more do you want out of your summer?","Pour Leur 25e anniversaire, nature One en Allemagne va encore plus grand que jamais avec 350 DJS et en direct agit sur plus de 20 étapes. Leur camping de 100 hectares promet d'être tout aussi fou. Production de scène massive, The Best Talent in the World, Alemand Tize Campgrounds - Que voulez-vous de plus de votre été?",Pydna Missile Base,Kastellaun,Germany,12,DE
Newport Jazz Festival 2025,https://www.musicfestivalwizard.com/festivals/newport-jazz-festival-2025/,https://www.musicfestivalwizard.com/wp-content/uploads/2017/07/Newport_Jazz_Festival_2017_Logo.jpg,2025-08-01,2025-08-03,"Breaking ground since the mid-1950s, the Newport Jazz Festival has a storied history rivaling that of any other American festival hosting artists like Herbie Hancock, Led Zeppelin, Frank Sinatra, Muddy Waters, The Allman Brothers, and Miles Davis.  Its current incarnation is three full days of jazz on four unique stages on the grounds at Fort Adams State Park in Rhode Island.","Brociser depuis le Mid-1950s, le Newport Jazz Festival a une histoire rivale rivalisant avec celle de tout autre festival américain hébergeant des artistes comme Herbie Hancock, a conduit Zeppelin, Frank Sinatra, Muddy Waters, The tout Davis.  Son incarnation actuelle est de trois jours complets de jazz sur quatre étapes uniques sur les motifs à Fort Adams State Park dans Rhode Island.",Fort Adams State Park,Newport,Rhode Island,12,RI
Nomade Reggae Festival 2025,https://www.musicfestivalwizard.com/festivals/nomade-reggae-festival-2025/,https://www.musicfestivalwizard.com/wp-content/uploads/2025/02/Nomade-Reggae-Festival-2025-Lineup-Poster.jpg,2025-07-31,2025-08-03,"Between lakes and mountains surrounded by nature in Anglefort, the vibe at Nomade Reggae Festival is the definition of chill.","Entre les lacs et des montagnes entourés par la nature à Anglefort, la vibe à nomade reggae Le festival est la définition de Chill.",Plan d’eau de Mansin,Anglefort,France,12,FR
